{
  "schema_version": "1.0.0",
  "artifact_id": "synthetic-rome-contract-v1",
  "artifact_kind": "synthetic-contract-fixture",
  "editor": {
    "name": "ROME",
    "revision": "0874014cd9837e4365f3e6f3c71400ef11509e04",
    "source_repository": "https://github.com/kmeng01/rome",
    "hyperparameters": {
      "layers": [0],
      "fact_token": "subject_last",
      "v_num_grad_steps": 20,
      "v_lr": 0.5,
      "fixture_notice": "Synthetic contract values; not an official model result."
    }
  },
  "model": {
    "architecture": "GPT2LMHeadModel",
    "baseline": {
      "state_id": "baseline-rome-fixture",
      "artifact_sha256": "1111111111111111111111111111111111111111111111111111111111111111"
    },
    "edited": {
      "state_id": "edited-rome-fixture",
      "artifact_sha256": "2222222222222222222222222222222222222222222222222222222222222222"
    }
  },
  "changed_tensors": [
    {
      "name": "transformer.h.0.mlp.c_proj.weight",
      "shape": [8, 8],
      "dtype": "float32",
      "device": "cpu",
      "baseline_sha256": "3333333333333333333333333333333333333333333333333333333333333333",
      "edited_sha256": "4444444444444444444444444444444444444444444444444444444444444444"
    }
  ]
}
